{
 "schema_version": "layer4.task.v1",
 "task_id": "p3b_fwd_fastapi_0033",
 "family": "forward_blast",
 "corpus": "fastapi",
 "pinned_commit": "313723494be79d4b24ccaa60e4f6d1f96c150fed",
 "focal": {
  "qname": "fastapi.params.Depends.__init__",
  "file": "fastapi/params.py",
  "line": 765,
  "index_file": "fastapi/params.py",
  "language": "python",
  "signature": "def __init__( self, dependency: Optional[Callable[..., Any]] = None, *, use_cache: bool = True ):",
  "is_async": false,
  "definition_sha256": "1faaeee9998fc699d60888f8f13c0d00edc0980870bddda68877b8edf186d95c"
 },
 "prompt": "In the fastapi repository, `fastapi.params.Depends.__init__` (in `fastapi/params.py`) is about to change: Depends.__init__() gains a required keyword-only argument `context` (a mapping of per-call settings); calls that do not pass it raise TypeError. Which functions and methods of the repository are affected - the code that calls `__init__` at runtime, directly or through at most 2 calls in between counting the direct call as one, and would have to be reviewed or adapted?",
 "provenance": {
  "tracer": "trace_py",
  "sce_commit": "cb9273b",
  "authored_at": "2026-10-24"
 },
 "change": {
  "kind": "signature",
  "description": "Depends.__init__() gains a required keyword-only argument `context` (a mapping of per-call settings); calls that do not pass it raise TypeError."
 },
 "answer_contract": "forward_json_v1",
 "arm_view": {
  "seed_symbol": "fastapi.params.Depends.__init__",
  "task_type": "blast",
  "oracle_symbols": [
   "fastapi.params.Depends.__init__",
   "fastapi.param_functions.Depends",
   "fastapi.param_functions.Security",
   "fastapi.params.Security.__init__"
  ],
  "oracle_required_context": [],
  "root_imports": [],
  "mask": {
   "symbols": [],
   "mode": "none"
  },
  "exclude_paths": []
 },
 "gold": {
  "source": "runtime_trace",
  "direction": "upstream",
  "affected_symbols": [
   "fastapi.param_functions.Depends",
   "fastapi.param_functions.Security",
   "fastapi.params.Security.__init__"
  ],
  "side_effects": null,
  "tables": null,
  "trace_manifest": "benchmarks/layer4_p3b/manifests/p3b_fwd_fastapi_0033.json",
  "trace_command": [
   "{python}",
   "-m",
   "pytest",
   "-q",
   "-p",
   "no:cacheprovider",
   "tests",
   "--deselect",
   "tests/test_fastapi_cli.py::test_fastapi_cli",
   "--deselect",
   "tests/test_tutorial/test_custom_request_and_route/test_tutorial002.py::test_exception_handler_body_access",
   "--ignore",
   "tests/test_tutorial/test_websockets/test_tutorial003.py",
   "--ignore",
   "tests/test_http_connection_injection.py",
   "--ignore",
   "tests/test_route_scope.py",
   "--ignore",
   "tests/test_ws_dependencies.py",
   "--ignore",
   "tests/test_ws_router.py",
   "--ignore",
   "tests/test_tutorial/test_websockets"
  ],
  "min_count": 1,
  "max_depth": 2
 },
 "validity": {
  "trace_exit_code": 0,
  "async_window": false,
  "contamination": {
   "arm0_score": null,
   "flagged": null,
   "seeds": []
  }
 }
}
